{"schema_version":"2.8","task_id":"b44e90cd-eaef-4b16-a40d-eaead304b813","config_digest":"sha256:b162920399fda84e36d26376ef6492b598b7d2e28a48a0652af2184e45811a25","error":{"code":2,"message":"flag provided but not defined: -typo"},"started_at":"2026-10-08T16:47:46.1189849+08:00","finished_at":"2026-10-08T16:47:46.1189849+08:00","platform":"windows","platform_meta":{},"prereq":{"archive_backend":null,"sevenzip_version":null,"archive_backend_status":"missing","mount_backend":null,"mount_backend_status":"missing","ocr_engine":"none","ocr_engine_path":null,"ocr_engine_status":"disabled","ocr_engine_version":null,"ocr_engine_languages":[],"ocr_startup_ms":0,"ok":false,"issues":[]},"summary":{"total":0,"by_status":{"already_installed":0,"failed":0,"installed":0,"partial":0,"skipped":0,"timeout":0,"triggered":0,"unverified":0},"flags":{"artifact_check_failed":0,"evidence_conflict":0,"pre_installed":0,"requires_reboot":0}},"layout_analysis":{"input_kind":"file","media_kind":null,"iso_strategy_used":null,"mount_drive":null,"dismount_status":"not_applicable","motw_policy":"native","entries":[],"excluded":[],"fallback_used":false,"converged_at":null,"skipped_after_success":0},"results":[],"truncated":false,"meta":{"resource_pack_version":"0.1.0","tool_version":"0.1.0"}}
